{
  "id": "royal-duel",
  "name": "Royal Duel",
  "description": "King / Rook / Bishop の最小構成で、ray 移動と捕獲勝利を試せる対局。",
  "board": {
    "width": 5,
    "height": 5
  },
  "players": [
    {
      "id": "P1",
      "name": "先手",
      "forward": 1
    },
    {
      "id": "P2",
      "name": "後手",
      "forward": -1
    }
  ],
  "turnOrder": [
    "P1",
    "P2"
  ],
  "pieceKinds": {
    "king": {
      "label": "King",
      "shortLabel": "King",
      "symbolByPlayer": {
        "P1": "♔",
        "P2": "♚"
      },
      "movement": [
        {
          "type": "step",
          "mode": "move-or-capture",
          "vectors": [
            [
              1,
              0
            ],
            [
              -1,
              0
            ],
            [
              0,
              1
            ],
            [
              0,
              -1
            ],
            [
              1,
              1
            ],
            [
              1,
              -1
            ],
            [
              -1,
              1
            ],
            [
              -1,
              -1
            ]
          ]
        }
      ],
      "evaluation": {
        "value": 100
      }
    },
    "rook": {
      "label": "Rook",
      "shortLabel": "Rook",
      "symbolByPlayer": {
        "P1": "♖",
        "P2": "♜"
      },
      "movement": [
        {
          "type": "ray",
          "mode": "move-or-capture",
          "vectors": [
            [
              1,
              0
            ],
            [
              -1,
              0
            ],
            [
              0,
              1
            ],
            [
              0,
              -1
            ]
          ]
        }
      ],
      "evaluation": {
        "value": 8
      }
    },
    "bishop": {
      "label": "Bishop",
      "shortLabel": "Bishop",
      "symbolByPlayer": {
        "P1": "♗",
        "P2": "♝"
      },
      "movement": [
        {
          "type": "ray",
          "mode": "move-or-capture",
          "vectors": [
            [
              1,
              1
            ],
            [
              1,
              -1
            ],
            [
              -1,
              1
            ],
            [
              -1,
              -1
            ]
          ]
        }
      ],
      "evaluation": {
        "value": 7
      }
    }
  },
  "actionCatalog": [
    {
      "type": "move-piece",
      "pieceKinds": [
        "king",
        "rook",
        "bishop"
      ]
    }
  ],
  "initialState": {
    "pieces": [
      {
        "kind": "rook",
        "owner": "P1",
        "x": 0,
        "y": 0
      },
      {
        "kind": "king",
        "owner": "P1",
        "x": 2,
        "y": 0
      },
      {
        "kind": "bishop",
        "owner": "P1",
        "x": 4,
        "y": 0
      },
      {
        "kind": "rook",
        "owner": "P2",
        "x": 0,
        "y": 4
      },
      {
        "kind": "king",
        "owner": "P2",
        "x": 2,
        "y": 4
      },
      {
        "kind": "bishop",
        "owner": "P2",
        "x": 4,
        "y": 4
      }
    ]
  },
  "termination": {
    "winConditions": [
      {
        "type": "capture-all",
        "label": "相手の king を取る",
        "pieceKind": "king"
      }
    ],
    "drawConditions": [
      {
        "type": "move-limit",
        "label": "80 手で打ち切り",
        "maxMoves": 80
      }
    ]
  },
  "evaluation": {
    "weights": {
      "material": 1,
      "mobility": 0.18,
      "centerControl": 0.08,
      "advancement": 0,
      "linePotential": 0
    }
  }
}
