{
  "id": "connect-four",
  "name": "Connect Four",
  "description": "7x6 の重力付き配置ゲーム。列に駒を落として 4 連結を作る。",
  "board": {
    "width": 7,
    "height": 6
  },
  "players": [
    {
      "id": "P1",
      "name": "先手",
      "forward": 1
    },
    {
      "id": "P2",
      "name": "後手",
      "forward": -1
    }
  ],
  "turnOrder": [
    "P1",
    "P2"
  ],
  "pieceKinds": {
    "disc": {
      "label": "Disc",
      "shortLabel": "Disc",
      "symbolByPlayer": {
        "P1": "●",
        "P2": "○"
      },
      "evaluation": {
        "value": 1
      }
    }
  },
  "actionCatalog": [
    {
      "type": "place",
      "pieceKind": "disc",
      "constraints": [
        {
          "type": "empty"
        },
        {
          "type": "gravity"
        }
      ],
      "inventory": {
        "byPlayer": {
          "P1": 21,
          "P2": 21
        }
      }
    }
  ],
  "initialState": {
    "pieces": []
  },
  "termination": {
    "winConditions": [
      {
        "type": "line",
        "label": "同じ色を 4 つ並べる",
        "pieceKind": "disc",
        "length": 4,
        "directions": "orthogonal+diagonal"
      }
    ],
    "drawConditions": [
      {
        "type": "board-full",
        "label": "盤面が埋まる"
      }
    ]
  },
  "evaluation": {
    "weights": {
      "material": 0,
      "mobility": 0.02,
      "centerControl": 0.35,
      "advancement": 0,
      "linePotential": 2.4
    }
  }
}
